Nombre del servicio,Clave del servicio,Linea de Servicio,Precio de Venta ,Unidad de medida,Disponible en punto de venta,Clave SAT,Codigo de barras,Días para poderlo entregar al cliente,Descripción del servicio,Coste,Días de garantía,Comision de venta,Comision por referencia,Politica de Facturación,Al vender el proyecto: ,"Nombre de la plantilla Correspondente
*Llenar solamente si se genera un proyecto en base a una plantilla",Nombre de la plantilla a la cuál se agrega la tarea
Procesos,PR001,Consultoría,10000,Hora,no,,,,Procesos,,,,,Por entrega, Se crea un proyecto en base a una plantilla,Plantilla Procesos,
Logotipos,PR002,Ayuda,15000,Unidades,no,,,,logotipos,,,,,Por entrega, Se crea un proyecto en base a una plantilla,Plantilla Comunicación,
Comunicación,PR003,Consultoría,12000,Hora,no,,,,comunicación,200,,,,Por Proyecto,Se crea un nuevo proyecto ,,
Asesoría,PR004,Consultoría,1000,Unidades,Si,,,,asesoría,,,,,Por horas trabajadas,Se agrega una tarea,,Horas